{
  "$schema": "https://json-schema.org/draft/2020-12/schema",
  "$id": "urn:libredi:schema:job-envelope",
  "title": "Job envelope",
  "description": "Common shape of every job sent through the PostgreSQL queue (pgmq). The payload is described by the JSON Schema of its job type, next to this file. Files never travel in the queue: the payload holds archive references (SHA-256), not bytes.",
  "type": "object",
  "required": ["type", "version", "messageId", "environment", "enqueuedAt", "payload"],
  "properties": {
    "type": {
      "description": "Job type, lower case, dot separated: domain then action.",
      "type": "string",
      "pattern": "^[a-z][a-z0-9-]*(\\.[a-z][a-z0-9-]*)+$",
      "examples": ["message.parse"]
    },
    "version": {
      "description": "Version of the job type, that is of its payload schema. Readers ignore unknown properties within a version.",
      "type": "integer",
      "minimum": 1
    },
    "messageId": {
      "description": "The Libredi message this job works on.",
      "type": "string",
      "format": "uuid"
    },
    "correlationId": {
      "description": "Groups the jobs of one flow run, for tracing.",
      "type": "string",
      "format": "uuid"
    },
    "environment": {
      "description": "Test and production never share a queue message.",
      "enum": ["test", "production"]
    },
    "enqueuedAt": {
      "type": "string",
      "format": "date-time"
    },
    "traceparent": {
      "description": "W3C Trace Context, to follow a message across services.",
      "type": "string",
      "pattern": "^[0-9a-f]{2}-[0-9a-f]{32}-[0-9a-f]{16}-[0-9a-f]{2}$"
    },
    "payload": {
      "description": "Job-specific data, validated against the schema of the job type.",
      "type": "object"
    }
  }
}
